{
  "$schema": "https://json-schema.org/draft/2020-12/schema",
  "$id": "subject.schema.json",
  "type": "object",
  "additionalProperties": false,
  "required": [
    "id",
    "kind",
    "adapter",
    "identity",
    "capabilities",
    "configuration"
  ],
  "properties": {
    "id": {
      "type": "string",
      "minLength": 1
    },
    "kind": {
      "type": "string",
      "minLength": 1
    },
    "adapter": {
      "type": "string",
      "minLength": 1
    },
    "identity": {
      "type": "object",
      "additionalProperties": true,
      "required": [
        "id",
        "version"
      ],
      "properties": {
        "id": {
          "type": "string",
          "minLength": 1
        },
        "version": {
          "type": "string",
          "minLength": 1
        }
      }
    },
    "capabilities": {
      "type": "array",
      "uniqueItems": true,
      "items": {
        "type": "string",
        "minLength": 1
      }
    },
    "configuration": {
      "type": "object",
      "additionalProperties": true
    },
    "exposure_probe": {
      "type": "object",
      "additionalProperties": false,
      "required": [
        "required_tool"
      ],
      "properties": {
        "required_tool": {
          "type": "string",
          "pattern": "^[A-Za-z0-9_.:-]+$",
          "minLength": 1
        }
      }
    }
  }
}
